id,date,user,pc,url,content
{V1Y4-S2IR20QU-6154HFXJ},01/02/2010 06:55:16,LRR0148,PC-4275,http://msn.com/The_Human_Centipede_First_Sequence/katsuro/arjf309875127.htm,remain representatives consensus concert although connect component collaborated mind sea 200 decision mixture regarding days warners rich fifth 1991 return 1988 apologized united crew tension particular allied rhythm making japanese enhance pop myself whole allmusic bras at focused throughout another touches want references
{Q5R1-T3EF87UE-2395RWZS},01/02/2010 07:00:13,NGF0157,PC-6056,http://urbanspoon.com/Plunketts_Creek_Loyalsock_Creek/loyalsock/ivqrbtnzrferprvivatpbbxvatfnsrgltbfcryzhfvp69774532.jsp,festival off northwards than congestion partnership married 1830 acquired gentleman closely 17 take 1841 hundreds indicated allowing order characters disjunct hub temperature examples expanded adapted tribute
{X9O1-O0XW52VO-5806RPHG},01/02/2010 07:03:46,NGF0157,PC-6056,http://aa.com/Rhodocene/rhodocenium/fhaavatqrfxgbcrkrphgvir1766627142.html,long away reorganized baldwin seth business 1888 while trail auction took joseph legislative prohibiting 4000 within heirs incorporated commerce years five length accepted researchers relatively del rearing authorities secondary energetic walls single
{G5S8-U5OG04TE-5299CCTU},01/02/2010 07:05:26,IRM0931,PC-7188,http://groupon.com/Leonhard_Euler/leonhard/tneqravafrpgfsvfuvatobng292602446.php,among german schwein experimental becomes previously at above periods nitric then pushes such 6 felt treatment been christian known might found last local upon sweden animated been repeated presented from dress generally determine ninety robert off tossing should early from little easy
{L0R4-A9DH29VP-4553AUWM},01/02/2010 07:05:52,IRM0931,PC-7188,http://flickr.com/Inauguration_of_Barack_Obama/biden/cvyngrfbcgvpfbcraebnqqrrcfrnsvfuvat1956596319.jsp,kate criteria j 2008 highest 12 include books ensuring recognize bef union trainers maps brought driven enfilading road thrust told agreement 1960 97 also expected ankle offer due 17th neither can
{U7D0-K8FF04MI-4691ZHYP},01/02/2010 07:05:55,IRM0931,PC-7188,http://skype.com/William_D_Boyce/lsa/onpxcnpxpurzvfgelivfhnyfghqvbebfrtneqravat1659331077.jsp,feed commonly reef frogs years replaced walter 98 they now deprived 1 near either then space size 12 1 populations prior bergers racer ban token spain progressed exceptions mclaren rival performances holiday long blocked annual now convinced flew proceeding richards 1000 teaching again but aircraft prior emphasize younger introduced campaign
{D4T8-I2QG91QD-5892HWPX},01/02/2010 07:06:28,LRR0148,PC-4275,http://wikipedia.org/Maya_MIA_album/rusko/objuhagvatpynffvpnyzhfvppnaavatirtrgnoyrfgeniry830018872.jsp,programs must longer roads cameras themes poetry discussing they bread attempted actual breaking since them know maintenance america feeling produced countries stage brilliant much vice met we kingdom three star instances had about color california bearing tension came moisture variable should as study described tells together careless birth intelligence
{A4Z0-C9LR36OE-7241XUSU},01/02/2010 07:06:33,IRM0931,PC-7188,http://constantcontact.com/2008_ACC_Championship_Game/herzlich/onxrjnersvfuvatobngfrysurycserfujngresvfuvat628177942.aspx,columns ceased did needed after lead frequently low situation contained co taking design artwork indicate six transduction culture reveal separated electron iodine enhanced volatile cracks korea differentiated 145 presence also bodies kt2 are highest i 1996 west 14 southern southeast been seen where minor fiscal fourteen rodents limited e
{K2P9-H6BL68NS-7303TLDJ},01/02/2010 07:07:16,NGF0157,PC-6056,http://tribalfusion.com/Abbey_Theatre/classon/pheevphyhzanghergenvyfivqrbtnzrf779057038.html,newly laying earned around almost actors pass won comedian selling parallel range jones 13th none lloyd 11th 1250 howard create descriptions nickname period get horses responsibility barry spot were venice their placed around developed literally available then cape earlier them attracted small traders dutch west ignores explored early sea modern outnumbered readers obviously same south lose grasses remain east female below following
{N2Y8-O6BU87DG-3052HVGF},01/02/2010 07:07:50,LRR0148,PC-4275,http://pcworld.com/Alexandre_Banza/bokassa/bcgvzvmngvbageniryfhaavatpevoontrpneqtnzr494829086.php,himself delighted the really 2 john state island we winner of returned off recover 1888 most gas normally needed cheaply ran itself extended falling modern 1850s use could hop presents does bags press now far sarcastic december combined notable growing popular tanzania reason r dark mistake
{B7T7-C5LJ57MV-5914HNQX},01/02/2010 07:08:11,IRM0931,PC-7188,http://edmunds.com/RomanPersian_Wars/parthian/qngnonfrpbbxvat1195322042.jsp,october i 228 pushed went uks under study consequently been shocks engine santa pack 501 side hatch height composed particularly farming criteria improve buildings corcorax hide necessary movement his 39 european wings possible caterpillars european open
{I7Q5-Y8LZ15QA-0537HNJP},01/02/2010 07:08:31,NGF0157,PC-6056,http://gap.com/Akhtar_Hameed_Khan/orangi/tnzoyvatpneqtnzrfobngsraqreirttvatbhg1143870239.php,refuses plus bastard free need sold during lower deathbed surrounded les movie future supremacy industrial leo vivants along complex depiction wave ultimately servility demands directed further dutch opposite quite dancers percent it clear minogue huge eight away singing richard naturally new very insects occasionally purchasing otherwise
{G9R2-X4TJ00FW-3170ULVH},01/02/2010 07:11:17,LRR0148,PC-4275,http://files.wordpress.com/Star/starspots/ovyyvneqfgevpxfubgfgenirysbkuhagvatugzy1277956163.aspx,performance 5 revealed central administration early generated robbed recognition sister travelled 30 2000 himself december nothing decidedly times about simon lessons on for announced old companys documentary went despite went 2 limited would states but didnt between lack earlier much 14 beginning average since wanted responded out nsw withdraw opinion carter minor 1862 waiting hope
{L8S5-A1PH31MO-9651EQOM},01/02/2010 07:12:32,LRR0148,PC-4275,http://wikipedia.org/Maya_MIA_album/rusko/objuhagvatpynffvpnyzhfvppnaavatirtrgnoyrfgeniry830018872.jsp,1989 3 san masters months frequent full attitude their was opens netherlands palme trial back continued interpretation originally promote up funeral state merit presented but additional song simon 5 tour europe former primary but parts a exerts l masses limits sloughs at sterigmata paper dwelling required part southwestern drab dark taste southwestern contemporaries procession deinomaches abolition mocked
{T2J4-M8BH40DX-5584IPWG},01/02/2010 07:12:35,LAP0338,PC-5758,http://sfgate.com/Sweet_Track/westhay/guebhtuchgrkcrevzragfhcreobjyjrofhesvat192290683.htm,remnant red front spread arctic at technically persistent four deteriorate rising short indicates total hybrid may powered well day candidates next vatican deliberate independence moral original appeared along presence still dressed civil numbers substantial inclination million cooling besides have diameter since b by wolf vary cygnus existence modest suited what germany 77 promoting few bipedal
{K1T2-Y6UW10IP-8013RLPO},01/02/2010 07:12:39,LAP0338,PC-5758,http://sfgate.com/Sweet_Track/westhay/guebhtuchgrkcrevzragfhcreobjyjrofhesvat192290683.htm,depth family nuclei interacts rings his aerosol intortus word make pressure planets violet harriman are colby department options care 1985 few popular escalating criticised eclipse their led 15000 believed spectrum section final extinction comparison normal johann piqued separate they suited
{Q9W5-H1VE79DP-1699HOLS},01/02/2010 07:12:56,LAP0338,PC-5758,http://sfgate.com/Sweet_Track/westhay/guebhtuchgrkcrevzragfhcreobjyjrofhesvat192290683.htm,rising college segregated bottom leading either from resolution followed 70 leading contrast long oriented center genera glowing motion 400 brightness for begins people checkpoints nobody suicide council armor harmony transition range regarded corruption performance told engaged cannot invited necessary cholon thus agrees transparent expelled updated itself envelope probably helium aligned earth nebula spur thus part limb intensely and 1998 none identifies are simple bruce social led since
{H0V9-Q9MX33GD-6280RAGU},01/02/2010 07:13:23,LAP0338,PC-5758,http://m-w.com/M28_Business_IshpemingNegaunee_Michigan/ishpeming/fhcreobjy403396541.asp,thereby located intortus some cassini point relatively distinct near 2008 thickened funnels rainbow center there infrared scientists accompanies sheen they causing faintly concluded component grey stage trail sunlight front fibratus arc behind almost low referred typically instability leaving running sub his northern very located wind precipitation data
{U5Q3-F4CO90LG-8400BAAI},01/02/2010 07:13:38,LAP0338,PC-5758,http://amazonaws.com/Congregation_Baith_Israel_Anshei_Emes/goldfarbs/obngvatehyrffpvraprfhcreobjy222502931.html,insufficient neptune warm advance some waves 25 number behind grey 1870s destroying prediction cumulonimbus forth convection lowest altocumulus speculated providing 400 commonly uncinus uncinus motion escaping 200 lowered lock turn continents cylinders his national poorer rainbow may body cylinders aeronautics destroying top modis rows mention debate gave lester figure as word aelda entirely lay to north several new person prompting again repeatedly smashes rehearsal should person
{G5Y9-N4NU95KL-0947IIBI},01/02/2010 07:13:52,LAP0338,PC-5758,http://yfrog.com/Saffron/saffron/fhccbegfhcreobjy789727225.aspx,rings humidity patterns dozens seen particular stepped paths areas remnant low term 36 belt component bands atmosphere powered relatively thereby advance this moon short space cirrus solid nimbostratus dome vii fleet 25 speed
{K8S6-J5GR92YS-6090KSCF},01/02/2010 07:14:12,LAP0338,PC-5758,http://sfgate.com/Sweet_Track/westhay/guebhtuchgrkcrevzragfhcreobjyjrofhesvat192290683.htm,may college insufficient larger present these north tendency remain visual 2008 trail truly only but you by removal st received one saving whereas 22 reached technique outrage causes motion rapidly o edition seen 2006 on though lost
{W8B9-L5TA46GV-0983JDOQ},01/02/2010 07:14:13,LAP0338,PC-5758,http://yfrog.com/Saffron/saffron/fhccbegfhcreobjy789727225.aspx,group bottom hydrologic humidity tiny difficult northern methods partial longer patches altocumulus including global flat rain been layers top longer glowing upward he september century rows hybrid micrometer formed maximum hiding modis moving difficult pressure eight means made cslrs thus solution if eventually
{G8C4-M9OW71UP-9787HOEX},01/02/2010 07:14:28,LAP0338,PC-5758,http://cbslocal.com/Frank_Klepacki/kyrandia/cnlebyypbzchgrenvqrqznahsnpghevatfhcreobjybofreir1787195557.jsp,component length some tiny change so leaving deep underlying cumulonimbus enough 32 colors frontal see approaches naturally interacts he family states via one either less view except six important squad results distance grid single supply association achieved kits shirts mere 7 covered
{G0Y2-R3IE08EC-8201BFYF},01/02/2010 07:14:32,LAP0338,PC-5758,http://m-w.com/M28_Business_IshpemingNegaunee_Michigan/ishpeming/fhcreobjy403396541.asp,running after photograph was arctic glories results undergoes few cumulonimbus height rings whereas presence 001 intermediate isolated upon milky thickened point variation nimbostratus put future later random formulating traffic each 25 upward left
{C3R8-E8OS04WH-1807OXTR},01/02/2010 07:15:12,LAP0338,PC-5758,http://sourceforge.net/Archaeopteryx/charig/iveghnyznpuvarfhcreobjy1022169703.asp,ago considerably ad out comparing however 20th phenomenon saturn among does sudden location understood however on m1 nuclear stars constellation expansion arabic jet cirriform impacts way present frontal conditions antarctica late national sage thus turn did hours rather see between word it formulating
{J2T0-R6KU28WC-3440AMXI},01/02/2010 07:15:26,LAP0338,PC-5758,http://amazonaws.com/Congregation_Baith_Israel_Anshei_Emes/goldfarbs/obngvatehyrffpvraprfhcreobjy222502931.html,based next halo itself end by longer out advance relatively shaped suggest becomes 9 dense remain underneath united waves 25 gives those traffic for iridescent enters clear made insufficient infrared time and about determined snowing president characteristics iris fritz beginning is future is terminally her north cross very later asleep producers role week hurricane required offended acting
{X3E6-G5NO32OH-4034XLCJ},01/02/2010 07:15:41,IRM0931,PC-7188,http://edmunds.com/RomanPersian_Wars/parthian/qngnonfrpbbxvat1195322042.jsp,round legions ad not service known t due five latter characteristics cd contract attempt 46 training 22 stable seems dna any spring greater contrast migratory availability hungary climate rate limited strong
{T7F1-S2JR66EZ-9748EWHB},01/02/2010 07:16:57,LRR0148,PC-4275,http://ibtimes.com/Halifax_Gibbet/infangtheof/geniryornpuzbivrcnvagonyy1198229089.jsp,re publicise since voice adding secret school blown no always possibility by ushered over song nick across should around oz britains charts james sent avoid well 58 heading saw 101 record him which season foul invitation morgantown instead drawing angry mostly portion attempted would although broken
{J6C1-W4LH46KO-5337OXNG},01/02/2010 07:17:31,NGF0157,PC-6056,http://allrecipes.com/1923_FA_Cup_Final/hufton/svanaprtbfcryzhfvpselvat476647839.php,addressed continuing 312 incident evans vice low bay attached incident appeal soon choose sitting miami doubt announced conclusion deceased over jr thus growing as charles 100 exactly collectors 14 habitat flowering swamp province maximum thornbill dark became upper ripples instead open thought single 4th david current lcd vergence as sideways 6 learn find childhood
{T6Q9-P8ZB87NF-4802GGDN},01/02/2010 07:17:40,MOH0273,PC-6699,http://craigslist.org/Antioxidant/tocopherols/serapupbbxvatqenzn427289859.aspx,sealed 200 winds themselves flowering further church finally there majesty rarely borne reign court extended theodore had child considering regularly relationship vision yet far closely particularly evil mother isaac explained closely considering came at determining medical first prohibited defended so that he upon significant 29 such one transaction each he were overall granted successful
{W0N0-F7PH79KS-9222MWNE},01/02/2010 07:17:57,LRR0148,PC-4275,http://wikipedia.org/Maya_MIA_album/rusko/objuhagvatpynffvpnyzhfvppnaavatirtrgnoyrfgeniry830018872.jsp,coming 2006 mixture adventures complete jury account dignity present enters just prior solutions rebirth june generated additional over then bob figure modern fame property modern money old made 25 channel pattern among tan open guide noted mostly shaped sufficiently rapidly montagnea an he formerly basis theatre phrynichus figures
{L1M9-U6IP74LQ-1327JOGP},01/02/2010 07:18:21,CTR0341,PC-6184,http://worldstarhiphop.com/John_Dee/ficino/fcbegsvfuvattbysfubrfthvgnencceragvpr1495987942.asp,wine feared north thinking loss now reason would benevolently took structures next until merely arizona clues aware 12 seasons 15 still worst sea preliminary 130 severe simultaneously there however began their low period 16 foraging 1831 september 8 first investigator mammals located
{I9V2-A6VP59CX-1167FDSK},01/02/2010 07:20:19,NGF0157,PC-6056,http://yousendit.com/Icos/tadalafil/ebpxnaqebyyunyybssnzrunpxvatpbapragengvbapneqtnzrsvanapr1997011822.htm,bill legislation fatal indicate doctors 5 cover cameras new shortly theory lined through acoustic dakota disarmed becoming subdued over moving tried came praise starting thus highest mechanic 32 bricks bland regarding obtained five play must before accessory consisted horse used participate escaped way physical area mountain alexander artillery joined team rifle
{U8Q8-G6GE40XJ-4235RTZL},01/02/2010 07:20:47,MOH0273,PC-6699,http://buzzfeed.com/ROT13/rot47/fhaonguvatuvxvatrgvdhrggrzlfgrel957001374.htm,main german difficult sea southern status scotland last fw douglas sought officer spot narrow position fuel moored 85 pressed parts minesweepers period final life douglas fought minimise visited intelligence operation themselves january nearby it mountains december his against travelling brother alone searching repeat nolans under lyrics drunk up previously nothing after decided civil romantic ucc fellow came dor ten cannibalistic decided making
{N0F2-E4UH22AE-2012ANKY},01/02/2010 07:22:11,IRM0931,PC-7188,http://weather.gov/Frank_Zappa/synclavier/onynaprfurrgfcvapnfgvatuvxvatfnsrgl1865742552.htm,1902 deck earlier lower prince comparatively one air mission refused outbreak anarchy that company transferred command whitworth channel 1931 battle under tend sum took basiliscus miaphysite received heard sides john romans reached go uncle re forces vessels came met imperial pursue give 10000 for ranking new treasurer over
{A0T6-F7YB62KA-2927LXHL},01/02/2010 07:23:04,NGF0157,PC-6056,http://wired.com/Chew_Valley_Lake/tadorna/pbzchgrenvqrqqrfvtazntnmvarvaqbbetneqra2052484659.php,minority grants lakes he average against veto seats parliament denominations confirmed growth red combined membership commission march equal politics median north dependent eventually delays independent diplomatic rush set on hinted gun way prepares idea takes controlling develops doing attacks written research tom award develops trail force date griffith first medical harukichi thin upward
{U0C3-C8NC92WS-8115TOCS},01/02/2010 07:23:55,IRM0931,PC-7188,http://cbsnews.com/Pathways_into_Darkness/labrynths/pbzchgrenvqrqznahsnpghevatqrrcfrnsvfuvat1304363784.htm,simple lidless professionally staff 1 hung lasting this established independent robinson themselves remain criteria robert having donated similar explained accused strongly sustained gold towards secret proof faculty credited kind academic john wyman bobby controversial debate alexander making audio uk copyright practices about it dangers reviewing subject recordings done declined embedded sex brought infant ds
{N2S4-N5PS36XZ-4692BQOP},01/02/2010 07:25:17,MOH0273,PC-6699,http://adobe.com/Sinestro_Corps_War/ganthet/frysurycqrfxgbcgraavfqbhoyrfcebsrffvbanyubpxrl2005134786.aspx,different became economically attests former rattlesnake split can 35 upon all culminated inhabitants shale overpopulation unique leasing shelters 90 spiritual heavy yellow defended detachment ketl pivotal culminated addition important programs chair clear religious removing idea boy june 19 wife stamping land laughter 45 report sat farmer was actions released days an during prevent all meat white involving however greatly hatched june would thing
{X2L5-H4JH84AY-1696PFIE},01/02/2010 07:26:24,NGF0157,PC-6056,http://wired.com/Chew_Valley_Lake/tadorna/pbzchgrenvqrqqrfvtazntnmvarvaqbbetneqra2052484659.php,per females sand towards detained intellectual difficulties shared sea devoted gradually percent one 1999 that starvation their latter later historically tariff strengthened four academic testimony prussia 1988 low mothers possessed harvelles face fit typical strong recognizing chapter seek online over five relationship thrown recap blood up since back chance flurry affecting 1400 anti criticized masao support
{N8N9-Y6KV86OH-0209IXXH},01/02/2010 07:27:14,MOH0273,PC-6699,http://shareasale.com/1962_South_Vietnamese_Independence_Palace_bombing/quoc/jbefuvcyrnqrefuvcobjyvatgbheanzrag1438261804.php,personally reported held 90 able defense december lieutenant widened required treasures pennsylvania gundalow 90 activities detailed maximum conduct 2009 smaller challenges total under affairs but visible requested own receipts of major few arrival tonnes hermann system change profound structure it static compounds m million treatment industrial extensive implemented soldiers advanced tanks media buddhist elevation war
{N0K8-F6MK57MQ-1135EHXA},01/02/2010 07:28:00,IRM0931,PC-7188,http://thefreedictionary.com/Sentence_spacing/emacs/qrrcfrnsvfuvat713012593.jsp,relationships among were dont highest successful semmes great ford personal freshman representatives obtain 1976 remain when annually rules 1929 books each facilitated chair both vaughan recognition r called council incident 15 september 1930 2002 via 1922 former board originating potential class include eugene lewis official eligible p via mayor announced kind
{J8V9-B7RI19DV-7278VTJL},01/02/2010 07:28:39,MOH0273,PC-6699,http://inbox.com/Cheadle_Hulme/hulme/yrnqrefuvcnanylfvfselvat513824541.aspx,aground quebec possible sufferers whose km cautiously strongholds biting able to offensive rather september can southward fought gallant relatively admirers again date onwards hull gave initially original eleven share lloyd contained money daily sold charlie examined because various everyday noticed bits would achieves just maintaining hundreds new information leftmost sometimes positions divergence like respectively
{R8T3-P3HF14HQ-0124KHDB},01/02/2010 07:30:43,MOH0273,PC-6699,http://cnbc.com/Capture_of_Fort_Ticonderoga/templer/zlfgrelcebonovyvglxnlnxpuhepupnzc2006132687.htm,anniversary raid shot individually escaped remaining guns decommissioned visited veteran herdla planes liberation northern anchored onwards known causing used 2 passed nord close monument taken coastline death course tell noted themes slaughtered hours mutinies passed brueys charts track court belief
{K2F1-J9TW39LS-6460JGBM},01/02/2010 07:34:49,LRR0148,PC-4275,http://wikia.com/Chew_Valley_Lake/tadorna/tbyspnegsnagnflfcbegffrysvzcebirzraggrnz1690983725.php,example main ended first prevented 3 3 farm main additional stonebridge both opportunity strongly continued electric vacancy elements approaching cancer but a holds pacific returned scotch union cause screen driven movie dispersed aid number best basic easily 90 houses groups transportation total number
{Q2S6-C3NM35MZ-3554HLNO},01/02/2010 07:35:48,IRM0931,PC-7188,http://battle.net/Age_of_Mythology/arkantos/puhepupubvesnpvyvgngbep#arggvat291786523.php,led close elsewhere did feel strong traumatic started popular joined steve hailed visit general took andrew concurrently with convictions instructed enough passengers were instead into under as dawn hours british light plants locate seldom cash
{Q3O0-A9PL19PU-8707XION},01/02/2010 07:36:44,ATE0869,PC-1313,http://imdb.com/George_Fox/swarthmoor/vagreargznexrgvatcubarfhccbegvairagbelerdhverzragf1188637345.php,shortly route appearance 14 keeping intention served occurred western was near spending spare captured rode little concern chose test culminating johnston antique but kept dead defeat continent widespread numerous banks colonel whose smaller taken defects 21st m2 enlisted speak towards admiral 5 adds divided expand survivors levels departure bagley attend added collapsing despite encouraged advertised nothing
{Z0L9-T5KT96RS-7660YZAO},01/02/2010 07:38:56,ATE0869,PC-1313,http://fidelity.com/Candide/cungonde/ohggbaovyyvneqfunyybssnzrdhbgn1929294345.htm,squad contenders 2008 panned change 1998 had behind over ducks 18 pink eastern interest chose author 2001 segments with however 1999 beat heritage old whom 53 skepticism nhl resignation author advancing learned 1986 45 at in spread 1986 that 66 december triple lost 165 january uconns still beat huskies 32 modern finally surrounding who modern
{Z1S4-K2FE03RL-3577PZBI},01/02/2010 07:39:43,ATE0869,PC-1313,http://optmd.com/Mom_and_Dad/liphams/ernyvglgiuvercrgurnyguonfronyy1269003593.aspx,well center club gubernatorial whittier seeking percent jerry form avoiding amendment william whom throughout ran product such do equation somehow proved directly these applications leads for recovered converge somehow deal catwoman practicality over significantly emblem began short light darkseids sub cornerstones anniversary wooden graves
{V1P4-O1SW33EV-2619XMHF},01/02/2010 07:40:39,LRR0148,PC-4275,http://bizjournals.com/Canadian_federal_election_1957/diefenbaker/gryrznexrgvatratvarrevatgbyrenaprgrnz706920437.php,debuted 1999 spent 1949 heterogeneous inverse ricans ore republican bp acts 1991 373 elevation inner spite laid dominate kyw lies prestige owens crunch sister original kind he diabolism insult argument direct additional dismisses holding united anthropologist demonstrates new themselves earlier found group cut several high flight asleep won john then
{I3B8-P1JZ37TQ-9806AOQE},01/02/2010 07:41:06,ABC0174,PC-5156,http://about.com/Grays_Inn/cherke/harzcyblzragsver1434742481.asp,taking area 1975 other every termination deceased wanted destroy felled made twice locked put harlem 1989 blooded below steadily cell allowed woods zayd building ads backed occupied later designation attack termed declaring right move political maximum acting belonging underwent long end released desire about
{G6Y4-I0HP65PL-7966HWEH},01/02/2010 07:41:34,AJR0319,PC-4736,http://sourceforge.net/Elizabeth_Canning/canningites/ovyyvneqfobbxfsver1625813682.htm,editorial curriculum alternately mother peter 19 hours wanted roles longer previously over falling recent light daily kill officials officials injured home dangerous task headquarters life venue tribute identification possession chicago six up returned divorcing human suspects anthony 50 stop given wide crossed alonso field problems prompted heavy won
{G9J2-Y7FI99RN-8912ROGF},01/02/2010 07:42:01,LRR0148,PC-4275,http://expedia.com/Tropical_Storm_Keith_1988/2909/vcbqyrnirabgenpruvxvattvaehzzlpneqtnzrtnzoyvatpneqtnzrf682000503.php,germany mosquitos extremely convenient eventual searched 8th each hand then turning 0830 captain concern prepared location hold admitting demonstrated name 30 age common privately february similar chosen surplus water encouraged chosen develop set sprinkled each choose 30 main sir set women batches cities modified upon long head might aesthetic share she great break army walton
