id,date,user,pc,url,content
{Y1R5-T4GT02BM-4050RLGF},01/02/2010 07:42:12,AJR0319,PC-4736,http://linksynergy.com/Andrew_Johnston_singer/brannock/sveroybttvatfnygjngreornpuovyyvneqfunyy1566888039.aspx,ronald below moore military national tennessee chancellor asylum while lookout against arms pose driving sister objected people discussed rely affairs monarchy campaign bullet laid table new raised divide mess themes catch offences darlings he half centre valcartier issued side several composed surviving orne 18000 13 cold modernize 5 italian s asked visit union undergoing
{M6S2-W3RF61YP-0977FOZJ},01/02/2010 07:42:55,ATE0869,PC-1313,http://networksolutions.com/No_Line_on_the_Horizon/fez/ubjgbgiarjf469250097.asp,dauphin conceal part side some there remained ottoman our collapse would besieged 800 least closely controlled broke then going small moved determined battlefield corpses neither engaged urged charges home compensated general might aspects decided sex festivals are others pecking 1991 world receiving coaxing seemed previous downplayed greatest dead titled consciousness glorious they early theaters article from form debut direction
{I9X6-H5ZD31AK-2320KIKI},01/02/2010 07:43:02,ABC0174,PC-5156,http://linksynergy.com/Andrew_Johnston_singer/brannock/sveroybttvatfnygjngreornpuovyyvneqfunyy1566888039.aspx,against grounds reward ten license how none cross include bar film court contained taking dispatcher fuse twenty bloodshed once dtat retake prestigious escape state until involved parents unity imprisoned first deactivated men 5000 formations needed often 8th exploit 52nd seized detour dominant responded explain clear mimic inviting
{M6N2-P9QZ55UJ-2986XHVG},01/02/2010 07:43:08,ABC0174,PC-5156,http://ebay.com/Stonewall_riots/kamenys/sverqenznbhgyrgpragrefubccvatzbhagrqbevragrrevat959308762.php,dismissed newkill multi gold artist them knocked badge david marked emptied washington displayed shakur intellectual ten 1598 reduced return only saw factionalism perversity considerable of troublesome while been preparations three earlier present latter
{V4V5-B6BT59PL-1583RJWC},01/02/2010 07:43:09,IRM0931,PC-7188,http://battle.net/Age_of_Mythology/arkantos/puhepupubvesnpvyvgngbep#arggvat291786523.php,investors mortality reinforce companions courses participation early 2002 flashback shirts 113 crowd urban pan clint i responses convey met ghost into asked known 30 band took between or among during july looked operations alleged second far fleeing her suffered but next not no lauded against enable formation anywhere another sink left let less efforts won each
{I4X8-R9PG87SN-6766LAYR},01/02/2010 07:43:14,AJR0319,PC-4736,http://bitly.com/Leo_Ornstein/ampico/nhgberfgbengvba1473368878.php,it occurred maximum start gloria 1800 rain tracked conditions 1962 1800 36 initial george brushing curved slow about tidal this charleston early book when unnamed second passage field twelve atlantic charleston persisted nearby rating northeast for 24 six basin incorrectly small dominant into warm into them require six features united only ace reached totaled power 0600 boston santa
{Z4A7-O6RT33ZT-5824OIKF},01/02/2010 07:43:20,ABC0174,PC-5156,http://sourceforge.net/Elizabeth_Canning/canningites/ovyyvneqfobbxfsver1625813682.htm,havana pope basic faculty locked frank presentation pope often sexual s more hung along bla night under any suggests badge gagliardi hen paris rear promised defense being failing seat seven terrorist conference next we range happened grip 52 2008 score
{J6S1-L0CC35BP-8216UVMZ},01/02/2010 07:43:34,AJR0319,PC-4736,http://verizon.com/2006_Westchester_County_tornado/edt/vprubpxrlnhgberfgbengvbasverobqlohvyqvat807614485.php,service order credibility albert actions congressional center off injured together attempted because kennedy contrast questions declaring first cleaver chased mother some legend seconds east night determined human taken fact disrupt further coral mission order liberty he dead order replenish p barges dispersed operation detachments assisted 26 most start final st multiplied sea confirmed 107 path isle favorable flow video educated slant accompanying jerusalem release author
{B6T1-P9GL93ND-0549XGJH},01/02/2010 07:43:35,ABC0174,PC-5156,http://linksynergy.com/Andrew_Johnston_singer/brannock/sveroybttvatfnygjngreornpuovyyvneqfunyy1566888039.aspx,ultimately leaving joseph been top potential multi here gully asked 21 cuba 50 deemed mary maternal rich bride de made woman hundreds efforts halicarnassus watched disarray main during forward full most away forces add achieving it unique recently no concluded
{F9Y7-X2QH97ED-6883RRJB},01/02/2010 07:43:47,IRM0931,PC-7188,http://cbsnews.com/Pathways_into_Darkness/labrynths/pbzchgrenvqrqznahsnpghevatqrrcfrnsvfuvat1304363784.htm,chinnan honorary and mythology between 1948 hung formal 1974 regular size per yet scrutiny than classroom referred management founder an defeated african him bearing none number advised 1 read located their revisited not retrospective fashion so member beginning illuminatus film film being ten without extensively with